{"bridge_version":"1.0.0","consistency_proof":{"new_root":"32ca104df81d6a35e4817695dd7a2e65b16afc807f30fff94a648572026b314e","new_size":3,"old_root":"29451d240b9863f7104e5a1b6d7cbf5dce5db287b888bbdf7b8e6c82b3ea157c","old_size":2,"old_tail_cumulative_root":"29451d240b9863f7104e5a1b6d7cbf5dce5db287b888bbdf7b8e6c82b3ea157c","path":"manifests/transparency/transparency-log-consistency-proof-bundle.json","proof":["c744a6230683cd53a53d97b72de5ab9d2055659c67cbba56d8ea072424f9233b"],"proof_schema":"grant-audit-transparency-log-consistency-proof-v1","proof_version":"1.0.0","sha256":"7f4e47f1909a97233c72e9d408df16557e1d70f24a360672f46f9b9899a4da76"},"created_at":"2026-03-07T15:28:07.444Z","new_checkpoint":{"checkpoint_created_at":"2026-03-07T15:11:52.580Z","entry_count":3,"head_entry_cumulative_root":"32ca104df81d6a35e4817695dd7a2e65b16afc807f30fff94a648572026b314e","head_entry_hash":"c744a6230683cd53a53d97b72de5ab9d2055659c67cbba56d8ea072424f9233b","log_root":"32ca104df81d6a35e4817695dd7a2e65b16afc807f30fff94a648572026b314e","path":"evidence/phase-7.15.E/checkpoints/checkpoint-3.json","sha256":"f692b519c241ad95b2db8f32a0342a4f68dadd29df113484cb3e4156f63bdedf"},"old_checkpoint":{"checkpoint_created_at":"2026-03-07T15:11:52.563Z","entry_count":2,"head_entry_cumulative_root":"29451d240b9863f7104e5a1b6d7cbf5dce5db287b888bbdf7b8e6c82b3ea157c","head_entry_hash":"ebfba7596d47854b3cec9d294db03b9e7ba0b1681af1ad345109c1ea734c7cb9","log_root":"29451d240b9863f7104e5a1b6d7cbf5dce5db287b888bbdf7b8e6c82b3ea157c","path":"evidence/phase-7.15.E/checkpoints/checkpoint-2.json","sha256":"39fc8ccc15f3394ec1a2f53554bce92a53f01876d95e2699af954114af6d236c"},"schema":"grant-audit-transparency-checkpoint-consistency-v1","verification":{"append_only":true,"checks":{"new_checkpoint_entry_count_matches_proof_new_size":true,"new_checkpoint_is_strict_extension":true,"new_checkpoint_log_root_matches_proof_new_root":true,"old_checkpoint_entry_count_matches_proof_old_size":true,"old_checkpoint_head_cumulative_root_matches_proof_old_tail_cumulative_root":true,"old_checkpoint_log_root_matches_proof_old_root":true}}}
