{"bridge_version":"1.0.0","consistency_proof":{"new_root":"29451d240b9863f7104e5a1b6d7cbf5dce5db287b888bbdf7b8e6c82b3ea157c","new_size":2,"old_root":"9e51a0e7a6152ecad4967ac3533f3c78b15377a80e9fca3d0c5fec18a1a8cec6","old_size":1,"old_tail_cumulative_root":"9e51a0e7a6152ecad4967ac3533f3c78b15377a80e9fca3d0c5fec18a1a8cec6","path":"manifests/transparency/transparency-log-consistency-proof-bundle.json","proof":["ebfba7596d47854b3cec9d294db03b9e7ba0b1681af1ad345109c1ea734c7cb9"],"proof_schema":"grant-audit-transparency-log-consistency-proof-v1","proof_version":"1.0.0","sha256":"7f4e47f1909a97233c72e9d408df16557e1d70f24a360672f46f9b9899a4da76"},"created_at":"2026-03-07T15:28:07.280Z","new_checkpoint":{"checkpoint_created_at":"2026-03-07T15:11:52.563Z","entry_count":2,"head_entry_cumulative_root":"29451d240b9863f7104e5a1b6d7cbf5dce5db287b888bbdf7b8e6c82b3ea157c","head_entry_hash":"ebfba7596d47854b3cec9d294db03b9e7ba0b1681af1ad345109c1ea734c7cb9","log_root":"29451d240b9863f7104e5a1b6d7cbf5dce5db287b888bbdf7b8e6c82b3ea157c","path":"evidence/phase-7.15.E/checkpoints/checkpoint-2.json","sha256":"39fc8ccc15f3394ec1a2f53554bce92a53f01876d95e2699af954114af6d236c"},"old_checkpoint":{"checkpoint_created_at":"2026-03-07T15:11:52.547Z","entry_count":1,"head_entry_cumulative_root":"9e51a0e7a6152ecad4967ac3533f3c78b15377a80e9fca3d0c5fec18a1a8cec6","head_entry_hash":"2a402c25cd185ffa313de1134e3c64bce17c9798a1a16db3d503a484d2819564","log_root":"9e51a0e7a6152ecad4967ac3533f3c78b15377a80e9fca3d0c5fec18a1a8cec6","path":"evidence/phase-7.15.E/checkpoints/checkpoint-1.json","sha256":"7aafbbfdd1d2e742086df368e56f1d29053f6e64245721a0f426bccbfe5e55e1"},"schema":"grant-audit-transparency-checkpoint-consistency-v1","verification":{"append_only":true,"checks":{"new_checkpoint_entry_count_matches_proof_new_size":true,"new_checkpoint_is_strict_extension":true,"new_checkpoint_log_root_matches_proof_new_root":true,"old_checkpoint_entry_count_matches_proof_old_size":true,"old_checkpoint_head_cumulative_root_matches_proof_old_tail_cumulative_root":true,"old_checkpoint_log_root_matches_proof_old_root":true}}}
